tconst	titleType	primaryTitle	originalTitle	isAdult	startYear	endYear	runtimeMinutes	genres
tt22511150	short	From the Bottom to the Top	From the Bottom to the Top	0	2020	\N	\N	Comedy,Short
tt22513966	short	3 Days, 3 Years	3 días, 3 años	0	2022	\N	30	Documentary,Short
tt22514892	short	Party or Parties Unknown	Party or Parties Unknown	0	2021	\N	\N	Animation,Short
tt22515108	short	PQA's 12 Days of Christmas	PQA's 12 Days of Christmas	0	2018	\N	\N	Musical,Short
tt22517430	short	Screenplay Movie: Naked to the Night	Screenplay Movie: Naked to the Night	0	2022	\N	34	Drama,Short
