tconst	titleType	primaryTitle	originalTitle	isAdult	startYear	endYear	runtimeMinutes	genres
tt7570000	tvEpisode	The American Dream - Mortgages and Real Estate	The American Dream - Mortgages and Real Estate	0	2017	\N	\N	News,Talk-Show
tt7570002	tvEpisode	Student Bodies: Beth Williams	Student Bodies: Beth Williams	1	2010	\N	\N	Adult,Documentary
tt7570004	tvEpisode	How Much Cum Will This Pretty Babe Swallow For A Free Phone	How Much Cum Will This Pretty Babe Swallow For A Free Phone	1	2013	\N	\N	Adult
tt7570008	tvEpisode	Jennie Reid: CyberGirl of the Month	Jennie Reid: CyberGirl of the Month	1	2010	\N	\N	Adult,Documentary
tt7570010	tvEpisode	April Showers	April Showers	1	2011	\N	\N	Adult,Documentary
tt7570012	tvSeries	Mensche i de Ostschwiz	Mensche i de Ostschwiz	0	2017	\N	21	Documentary
tt7570014	tvEpisode	Episode #2.4	Episode #2.4	0	2011	\N	\N	Comedy,Game-Show,Music
tt7570016	tvEpisode	Episode #2.5	Episode #2.5	0	2012	\N	\N	Comedy,Game-Show,Music
tt7570018	tvEpisode	Episode #7.3	Episode #7.3	0	2017	\N	\N	Comedy,Talk-Show
tt7570020	tvEpisode	Stories from the Lenape Room	Stories from the Lenape Room	0	2017	\N	\N	Adventure,Reality-TV
tt7570022	tvEpisode	The American Dream - Home Insurance for your Real Estate Endeavors	The American Dream - Home Insurance for your Real Estate Endeavors	0	2017	\N	\N	News,Talk-Show
tt7570026	tvMovie	Art & Soul	Art & Soul	0	2017	\N	26	Biography
tt7570030	tvEpisode	The American Dream - Be Happy and Donate your time to Charities	The American Dream - Be Happy and Donate your time to Charities	0	2017	\N	\N	News,Talk-Show
tt7570034	tvEpisode	Episode #2.41	Episode #2.41	0	2016	\N	\N	Drama
tt7570036	tvEpisode	Hey, Who Wants Pizza?	Hey, Who Wants Pizza?	0	2017	\N	\N	Talk-Show
tt7570042	tvEpisode	Las deudas pendientes de El Edén	Las deudas pendientes de El Edén	0	2003	\N	63	Comedy,Drama,Fantasy
tt7570044	tvEpisode	Facebook Marketing, Psychological Mindfulness, & Denver Real Estate Experts	Facebook Marketing, Psychological Mindfulness, & Denver Real Estate Experts	0	2017	\N	\N	News,Talk-Show
tt7570046	tvEpisode	Episode #2.7	Episode #2.7	0	2012	\N	\N	Comedy,Game-Show,Music
tt7570048	tvEpisode	Winner of the Big Game	Winner of the Big Game	1	2012	\N	\N	Adult,Documentary
tt7570050	tvEpisode	Episode #2.42	Episode #2.42	0	2016	\N	\N	Drama
tt7570052	tvEpisode	Morwen of the Woodlands	Morwen of the Woodlands	0	\N	\N	\N	Family,Fantasy
tt7570054	tvEpisode	Episode #2.6	Episode #2.6	0	2012	\N	\N	Comedy,Game-Show,Music
tt7570056	tvEpisode	Exotic Seduction	Exotic Seduction	1	2012	\N	\N	Adult,Documentary
tt7570058	tvEpisode	Clever Manka	Clever Manka	0	\N	\N	\N	Family,Fantasy
tt7570060	tvSeries	Journeys Through French Cinema	Voyages à travers le cinéma français	0	2017	2018	\N	Documentary
tt7570062	tvEpisode	The Widow's Lazy Daughter	The Widow's Lazy Daughter	0	\N	\N	\N	Family,Fantasy
tt7570064	tvEpisode	The Emperor and the Abbot	The Emperor and the Abbot	0	\N	\N	\N	Family,Fantasy
tt7570066	tvEpisode	Episode #1.1	Episode #1.1	0	2011	\N	\N	Comedy,Game-Show,Music
tt7570068	tvEpisode	Misty Rhodes: Cybergirl of the Month	Misty Rhodes: Cybergirl of the Month	1	2010	\N	\N	Adult,Documentary
tt7570070	tvEpisode	Simpleton Peter	Simpleton Peter	0	\N	\N	\N	Family,Fantasy
tt7570074	tvEpisode	Sweet Cream	Sweet Cream	1	2012	\N	\N	Adult,Documentary
tt7570076	tvEpisode	Fresh Faces: Misty Rhodes	Fresh Faces: Misty Rhodes	1	2010	\N	\N	Adult,Documentary
tt7570078	tvEpisode	The Perfect Prince	The Perfect Prince	0	\N	\N	\N	Family,Fantasy
tt7570080	tvEpisode	Facebook Marketing, Psychological Mindfulness, & Washington DC Real Estate Experts	Facebook Marketing, Psychological Mindfulness, & Washington DC Real Estate Experts	0	2017	\N	\N	News,Talk-Show
tt7570090	tvEpisode	Rich Man, Poor Man	Rich Man, Poor Man	0	\N	\N	24	Family,Fantasy
tt7570092	tvEpisode	Episode #1.2	Episode #1.2	0	2011	\N	\N	Comedy,Game-Show,Music
tt7570098	tvEpisode	Koko de Matsu: Luffy tai Ikari no Gundan	Koko de Matsu: Luffy tai Ikari no Gundan	0	2017	\N	\N	Action,Adventure,Animation
tt7570100	tvEpisode	Timbuktu - Der Weg ist das Ziel, Mali	Timbuktu - Der Weg ist das Ziel, Mali	0	1997	\N	\N	Documentary
tt7570102	tvEpisode	Facebook Marketing, Psychological Mindfulness, & Salt Lake City Real Estate Experts	Facebook Marketing, Psychological Mindfulness, & Salt Lake City Real Estate Experts	0	2017	\N	\N	News,Talk-Show
tt7570104	tvEpisode	Money Makes Athletic Beauty Jump On Stranger's Dick	Money Makes Athletic Beauty Jump On Stranger's Dick	1	2013	\N	\N	Adult
tt7570108	tvEpisode	Elizabeth Mendez: Cybergirl of the Month	Elizabeth Mendez: Cybergirl of the Month	1	2010	\N	\N	Adult,Documentary
tt7570110	tvEpisode	Episode #1.3	Episode #1.3	0	2011	\N	\N	Comedy,Game-Show,Music
tt7570112	tvEpisode	Die Wasserfälle des Iguazu, Brasilien/Argentinien	Die Wasserfälle des Iguazu, Brasilien/Argentinien	0	1997	\N	\N	Documentary
tt7570114	tvEpisode	Stranger Fucks A Horny Beauty In An Public Park	Stranger Fucks A Horny Beauty In An Public Park	1	2013	\N	\N	Adult
tt7570116	tvEpisode	Redhead Gives Sloppy Blowjob And Fucks Stranger	Redhead Gives Sloppy Blowjob And Fucks Stranger	1	2013	\N	\N	Adult
tt7570118	tvEpisode	Lost Brunette Finds Her Way Onto Stranger's Thick Cock	Lost Brunette Finds Her Way Onto Stranger's Thick Cock	1	2013	\N	\N	Adult
tt7570120	tvEpisode	Brittany Leigh: Cybergirl of the Month	Brittany Leigh: Cybergirl of the Month	1	2010	\N	\N	Adult,Documentary
tt7570122	tvEpisode	Babe With No Ticket Will Have To Take Stranger's Cum On Her Ass	Babe With No Ticket Will Have To Take Stranger's Cum On Her Ass	1	2013	\N	\N	Adult
tt7570126	tvEpisode	Völklinger Hütte - Eiserne Erinnerungen, Deutschland	Völklinger Hütte - Eiserne Erinnerungen, Deutschland	0	1997	\N	\N	Documentary
tt7570128	tvEpisode	Receptionist Sucks And Fucks For A Promotion	Receptionist Sucks And Fucks For A Promotion	1	2013	\N	\N	Adult
tt7570132	tvEpisode	Brunette's Big Tits Make Stranger Horny	Brunette's Big Tits Make Stranger Horny	1	2013	\N	\N	Adult
tt7570136	tvEpisode	Woman Is Selling Furniture And Her Perfect Curvy Ass	Woman Is Selling Furniture And Her Perfect Curvy Ass	1	2013	\N	\N	Adult
tt7570138	tvEpisode	Student Bodies: Jamie Bradford	Student Bodies: Jamie Bradford	1	2010	\N	\N	Adult,Documentary
tt7570140	tvEpisode	Milénium 1. cást	Milénium 1. cást	0	1999	\N	18	Documentary
tt7570142	tvEpisode	Stan Lee's L.A. Comic-Con 2017 Panel Show.	Stan Lee's L.A. Comic-Con 2017 Panel Show.	0	2017	\N	\N	Comedy,Horror,Mystery
tt7570144	tvEpisode	Episode #2.43	Episode #2.43	0	2016	\N	\N	Drama
tt7570146	tvEpisode	All Naturals: Jamie Bradford	All Naturals: Jamie Bradford	1	2010	\N	4	Adult,Documentary
tt7570152	tvEpisode	Jamie Bradford: Cybergirl of the Month	Jamie Bradford: Cybergirl of the Month	1	2010	\N	\N	Adult,Documentary
tt7570154	tvEpisode	Peterson Goes to Tennessee	Peterson Goes to Tennessee	0	2017	\N	\N	Comedy
tt7570158	tvEpisode	Milénium 2. cást	Milénium 2. cást	0	1999	\N	18	Documentary
tt7570160	tvEpisode	The American Dream: International Travel, San Diego Real Estate, and funny coincidences	The American Dream: International Travel, San Diego Real Estate, and funny coincidences	0	2017	\N	\N	News,Talk-Show
tt7570162	tvEpisode	Stranger Pays Barmaid To Fuck Her Big Booty	Stranger Pays Barmaid To Fuck Her Big Booty	1	2013	\N	\N	Adult
tt7570166	tvEpisode	Bethanie Badertscher: Cybergirl of the Month	Bethanie Badertscher: Cybergirl of the Month	1	2010	\N	\N	Adult,Documentary
tt7570168	tvEpisode	Angst vor der Bombe	Angst vor der Bombe	0	2017	\N	\N	Drama,Family
tt7570170	tvEpisode	Blowjob Lips On Brunette Babe Make Stranger's Dick Cum	Blowjob Lips On Brunette Babe Make Stranger's Dick Cum	1	2013	\N	\N	Adult
tt7570172	tvEpisode	Ass Fucking Blonde Babe In A Public Stairwell	Ass Fucking Blonde Babe In A Public Stairwell	1	2013	\N	\N	Adult
tt7570174	tvEpisode	Desperate Blonde Shows Her Tits And Pussy For Fame	Desperate Blonde Shows Her Tits And Pussy For Fame	1	2013	\N	\N	Adult
tt7570176	tvEpisode	Episode #1.4	Episode #1.4	0	2011	\N	\N	Comedy,Game-Show,Music
tt7570178	tvEpisode	Füreinander da sein	Füreinander da sein	0	2017	\N	\N	Drama,Family
tt7570182	tvEpisode	The American Dream - No More Sensationalism in the Media!	The American Dream - No More Sensationalism in the Media!	0	2017	\N	\N	News,Talk-Show
tt7570184	tvEpisode	Episode #2.44	Episode #2.44	0	2016	\N	\N	Drama
tt7570188	tvEpisode	Dark Haired Beauty Fails At Game, Wins A Mouth Full Of Cock	Dark Haired Beauty Fails At Game, Wins A Mouth Full Of Cock	1	2013	\N	\N	Adult
tt7570190	tvSeries	Komedy Kapers	Komedy Kapers	0	1956	1957	30	Comedy
tt7570194	tvEpisode	Blonde Happily Takes Stranger's Money And Cock	Blonde Happily Takes Stranger's Money And Cock	1	2013	\N	\N	Adult
tt7570198	tvEpisode	Episode dated 23 October 2017	Episode dated 23 October 2017	0	2017	\N	\N	Family,News,Talk-Show
tt7570200	tvEpisode	Jak se co delá 5. cást	Jak se co delá 5. cást	0	1999	\N	18	Documentary
tt7570202	tvEpisode	Episode #1.5	Episode #1.5	0	2011	\N	\N	Comedy,Game-Show,Music
tt7570204	tvSeries	17:38	17:38	0	2016	\N	\N	Comedy,Short
tt7570206	tvEpisode	The American Dream - Community Living Mindset Salt Lake City	The American Dream - Community Living Mindset Salt Lake City	0	2017	\N	\N	News,Talk-Show
tt7570208	tvEpisode	An Audition Always Leads To Hot Public Sex For Stranger	An Audition Always Leads To Hot Public Sex For Stranger	1	2013	\N	\N	Adult
tt7570212	tvEpisode	Fake Agent Gets His Dick Stuffed In A Curvy Ass	Fake Agent Gets His Dick Stuffed In A Curvy Ass	1	2013	\N	\N	Adult
tt7570214	tvEpisode	Desert Island	Desert Island	0	2017	\N	47	Adventure,Reality-TV
tt7570218	tvEpisode	Bubbly Blonde Likes To Have Public Sex For Money	Bubbly Blonde Likes To Have Public Sex For Money	1	2013	\N	\N	Adult
tt7570224	tvEpisode	Money Makes Pretty Blonde Fuck And Suck Stranger's Cock	Money Makes Pretty Blonde Fuck And Suck Stranger's Cock	1	2013	\N	\N	Adult
tt7570226	tvEpisode	Trading A Lift For A Cocksucking And Quick Fuck	Trading A Lift For A Cocksucking And Quick Fuck	1	2013	\N	\N	Adult
tt7570230	tvMovie	The Burning Book	Het Brandende Verhaal	0	1982	\N	\N	Documentary
tt7570232	tvEpisode	Bethanie Badertscher: Cyber Girl of the Year 2011	Bethanie Badertscher: Cyber Girl of the Year 2011	1	2011	\N	\N	Adult,Documentary
tt7570236	tvEpisode	Episode dated 22 October 2017	Episode dated 22 October 2017	0	2017	\N	\N	Family,News,Talk-Show
tt7570238	tvEpisode	A Tight Pussy Ride For Stranger Pretending To Be An Agent	A Tight Pussy Ride For Stranger Pretending To Be An Agent	1	2013	\N	\N	Adult
tt7570244	tvEpisode	Bethanie Badertscher: Cyber Girl of the Year Part 2	Bethanie Badertscher: Cyber Girl of the Year Part 2	1	2011	\N	\N	Adult,Documentary
tt7570248	tvEpisode	Episode #1.6	Episode #1.6	0	2011	\N	\N	Comedy,Game-Show,Music
tt7570250	tvEpisode	Bethanie Badertscher: Cyber Girl of the Year Part 1	Bethanie Badertscher: Cyber Girl of the Year Part 1	1	2011	\N	\N	Adult,Documentary
tt7570252	tvEpisode	Bethanie Badertscher: Cyber Girl of the Year Part 5	Bethanie Badertscher: Cyber Girl of the Year Part 5	1	2011	\N	\N	Adult,Documentary
tt7570254	tvEpisode	Strangers Serves Stranded Japanese Tourist His Cock	Strangers Serves Stranded Japanese Tourist His Cock	1	2013	\N	\N	Adult
tt7570256	tvEpisode	Stranger's Thick Cock Delights Blonde Babe At The Gym	Stranger's Thick Cock Delights Blonde Babe At The Gym	1	2013	\N	\N	Adult
tt7570258	tvEpisode	Bethanie Badertscher: Cyber Girl of the Year Part 3	Bethanie Badertscher: Cyber Girl of the Year Part 3	1	2011	\N	\N	Adult,Documentary
tt7570260	tvEpisode	The American Dream - Community Living Mindset Washington DC	The American Dream - Community Living Mindset Washington DC	0	2017	\N	\N	News,Talk-Show
tt7570262	tvEpisode	Bethanie Badertscher: Cyber Girl of the Year Part 4	Bethanie Badertscher: Cyber Girl of the Year Part 4	1	2011	\N	\N	Adult,Documentary
tt7570264	tvEpisode	Bethanie Badertscher: Cyber Girl of the Year Part 6	Bethanie Badertscher: Cyber Girl of the Year Part 6	1	2011	\N	\N	Adult,Documentary
tt7570266	tvEpisode	Bethanie Badertscher: Cyber Girl of the Year Part 7	Bethanie Badertscher: Cyber Girl of the Year Part 7	1	2011	\N	\N	Adult,Documentary
tt7570268	tvEpisode	Bethanie Badertscher: Cyber Girl of the Year Part 8	Bethanie Badertscher: Cyber Girl of the Year Part 8	1	2011	\N	\N	Adult,Documentary
tt7570272	tvEpisode	Busty Blonde Drives a Hard Bargain	Busty Blonde Drives a Hard Bargain	1	2013	\N	\N	Adult
tt7570274	tvEpisode	Jak se co delá 6. cást	Jak se co delá 6. cást	0	1999	\N	18	Documentary
tt7570276	tvEpisode	Episode dated 22 October 2017	Episode dated 22 October 2017	0	2017	\N	\N	News
tt7570278	tvEpisode	Brunette Sits Her Big Bubble Butt On A Strangers Hard Dick	Brunette Sits Her Big Bubble Butt On A Strangers Hard Dick	1	2013	\N	\N	Adult
tt7570280	tvEpisode	Dirty Maid Polishes Off Stranger's Cock Before Draining His Hot Cum	Dirty Maid Polishes Off Stranger's Cock Before Draining His Hot Cum	1	2013	\N	\N	Adult
tt7570282	tvEpisode	Bethanie Badertscher: Cyber Girl of the Year Part 9	Bethanie Badertscher: Cyber Girl of the Year Part 9	1	2011	\N	\N	Adult,Documentary
tt7570286	tvEpisode	Adorable Babe Sucks And Fucks Stranger To Buy Christmas Gifts	Adorable Babe Sucks And Fucks Stranger To Buy Christmas Gifts	1	2013	\N	\N	Adult
tt7570288	tvEpisode	Bethanie Badertscher: Cyber Girl of the Year Part 10	Bethanie Badertscher: Cyber Girl of the Year Part 10	1	2011	\N	\N	Adult,Documentary
tt7570290	tvEpisode	Alton's Challenge, Part 3	Alton's Challenge, Part 3	0	2017	\N	42	Game-Show,Reality-TV
tt7570292	tvEpisode	Raven and the Sea Wolf	Raven and the Sea Wolf	0	2017	\N	\N	Animation
tt7570294	tvEpisode	Red Hot Jam Vol.285 ~Special Box 6~: Yayoi Yoshino, Julia Nanase, Chiaki, Yu Mizuki, Aiko Hirose, and more	Red Hot Jam Vol.285 ~Special Box 6~: Yayoi Yoshino, Julia Nanase, Chiaki, Yu Mizuki, Aiko Hirose, and more	1	2013	\N	240	Adult
tt7570296	tvEpisode	Pretty Woman Gets A Big Dick Instead Of A Career On TV	Pretty Woman Gets A Big Dick Instead Of A Career On TV	1	2013	\N	\N	Adult
tt7570298	tvEpisode	Raven Goes Fishing	Raven Goes Fishing	0	2017	\N	\N	Animation
tt7570300	tvEpisode	Bethanie Badertscher: Cyber Girl of the Year Part 11	Bethanie Badertscher: Cyber Girl of the Year Part 11	1	2012	\N	\N	Adult,Documentary
tt7570302	tvEpisode	Prvá cena	Prvá cena	0	2017	\N	57	Action,Crime
tt7570306	tvEpisode	Fitness Babe Gets Her Tits Out And Fucks Fake Instructor	Fitness Babe Gets Her Tits Out And Fucks Fake Instructor	1	2013	\N	\N	Adult
tt7570308	tvEpisode	Alton's Challenge, Grand Finale	Alton's Challenge, Grand Finale	0	2017	\N	42	Game-Show,Reality-TV
tt7570310	tvEpisode	2017 MLB World Series Game 5: Los Angeles Dodgers vs. Houston Astros	2017 MLB World Series Game 5: Los Angeles Dodgers vs. Houston Astros	0	2017	\N	\N	Sport
tt7570312	tvEpisode	Raven Meets the Little Makers	Raven Meets the Little Makers	0	2017	\N	\N	Animation
tt7570314	tvEpisode	Pretty Woman Takes A Mouthful Of Stranger's Cum For A Free Phone	Pretty Woman Takes A Mouthful Of Stranger's Cum For A Free Phone	1	2013	\N	\N	Adult
tt7570316	tvEpisode	2017 MLB World Series Game 6: Houston Astros vs. Los Angeles Dodgers	2017 MLB World Series Game 6: Houston Astros vs. Los Angeles Dodgers	0	2017	\N	\N	Sport
tt7570320	tvEpisode	Raven Haired Hottie Gets A Hot Cumshot On A Speeding Train	Raven Haired Hottie Gets A Hot Cumshot On A Speeding Train	1	2013	\N	\N	Adult
tt7570322	tvEpisode	Feel the Burn	Feel the Burn	0	2017	\N	42	Game-Show,Reality-TV
tt7570326	tvEpisode	The Nut Job (E One) DVD Unboxing	The Nut Job (E One) DVD Unboxing	0	2017	\N	2	Reality-TV,Talk-Show
tt7570330	tvEpisode	Jak se co delá 7. cást	Jak se co delá 7. cást	0	2000	\N	18	Documentary
tt7570332	tvEpisode	Pie Jinks	Pie Jinks	0	2017	\N	42	Game-Show,Reality-TV
tt7570336	tvEpisode	Alton's Challenge, Part 4	Alton's Challenge, Part 4	0	2017	\N	42	Game-Show,Reality-TV
tt7570338	tvEpisode	Brunette Takes A Stranger's Hot Cumshot Thinking He's A Talent Agent	Brunette Takes A Stranger's Hot Cumshot Thinking He's A Talent Agent	1	2013	\N	\N	Adult
tt7570340	tvEpisode	Bethanie Badertscher: Cyber Girl of the Year Part 12	Bethanie Badertscher: Cyber Girl of the Year Part 12	1	2012	\N	\N	Adult,Documentary
tt7570342	tvEpisode	Flavor Savor	Flavor Savor	0	2017	\N	42	Game-Show,Reality-TV
tt7570344	tvEpisode	Lauren Elise: Cyber Girl of the Month	Lauren Elise: Cyber Girl of the Month	1	2011	\N	\N	Adult,Documentary
tt7570346	tvEpisode	Gimme Gator	Gimme Gator	0	2017	\N	42	Game-Show,Reality-TV
tt7570350	tvEpisode	Promises Of A Photoshoot Turn Into A Mouth Full Of Cum For Brunette	Promises Of A Photoshoot Turn Into A Mouth Full Of Cum For Brunette	1	2014	\N	\N	Adult
tt7570352	tvEpisode	Fresh Faces: Lauren Elise	Fresh Faces: Lauren Elise	1	2010	\N	\N	Adult,Documentary
tt7570354	tvEpisode	Redhead Gets A Free Ride In Exchange For Riding Cabbie's Cock	Redhead Gets A Free Ride In Exchange For Riding Cabbie's Cock	1	2013	\N	\N	Adult
tt7570356	tvEpisode	Nervous Blonde Nerd Loves To Fuck Strangers In Public	Nervous Blonde Nerd Loves To Fuck Strangers In Public	1	2014	\N	\N	Adult
tt7570360	tvEpisode	Hot Young Woman Shows Stranger Just How Deep Her Pussy Is	Hot Young Woman Shows Stranger Just How Deep Her Pussy Is	1	2014	\N	\N	Adult
tt7570362	tvEpisode	Raven and the Dogfish Woman	Raven and the Dogfish Woman	0	2017	\N	\N	Animation
tt7570368	tvEpisode	Sensuous Blonde	Sensuous Blonde	1	2012	\N	\N	Adult,Documentary
tt7570370	tvEpisode	Kinky Brunette Demands Stranger Fucks Her Hard	Kinky Brunette Demands Stranger Fucks Her Hard	1	2014	\N	\N	Adult
tt7570372	tvEpisode	Sensual Beauty	Sensual Beauty	1	2012	\N	\N	Adult,Documentary
tt7570374	tvEpisode	Her Virtual Fantasy	Her Virtual Fantasy	1	2012	\N	\N	Adult,Documentary
tt7570378	tvEpisode	Busty Babes: Sydney Barlette	Busty Babes: Sydney Barlette	1	2010	\N	\N	Adult,Documentary
tt7570382	tvEpisode	Blonde Babe Takes A Mouthful Of Stranger's Cum	Blonde Babe Takes A Mouthful Of Stranger's Cum	1	2014	\N	\N	Adult
tt7570384	tvEpisode	Curvy Blonde Takes All Of Stranger's Cock Deep Inside Her Pussy	Curvy Blonde Takes All Of Stranger's Cock Deep Inside Her Pussy	1	2014	\N	\N	Adult
tt7570386	tvEpisode	Red Hot Jam Vol.284 ~Catering Service~: Sayaka Nanairo	Red Hot Jam Vol.284 ~Catering Service~: Sayaka Nanairo	1	2013	\N	120	Adult
tt7570388	tvEpisode	Student Bodies: Sydney Barlette	Student Bodies: Sydney Barlette	1	2010	\N	\N	Adult,Documentary
tt7570390	tvEpisode	Pretty Babe Stuffs Her Pussy With Stranger's Cock For Fun	Pretty Babe Stuffs Her Pussy With Stranger's Cock For Fun	1	2014	\N	\N	Adult
tt7570392	tvEpisode	Hottie With Hot Pink Hair Shows Stranger Her Pink Pussy	Hottie With Hot Pink Hair Shows Stranger Her Pink Pussy	1	2014	\N	\N	Adult
tt7570394	tvEpisode	Stranger Finds An Easy Pussy To Fuck In Public	Stranger Finds An Easy Pussy To Fuck In Public	1	2014	\N	\N	Adult
tt7570398	tvEpisode	Short Haired Woman Gets A Special Offer For Stranger's Cock	Short Haired Woman Gets A Special Offer For Stranger's Cock	1	2014	\N	\N	Adult
tt7570402	tvEpisode	Ábrándok napja	Ábrándok napja	0	1997	\N	\N	Comedy,Family
tt7570406	tvEpisode	New Tenant Sucks Stranger's Cock To Pay For Pricey Rent	New Tenant Sucks Stranger's Cock To Pay For Pricey Rent	1	2014	\N	\N	Adult
tt7570408	tvEpisode	Broke College Student Jumps On Stranger's Dick To Pay For School	Broke College Student Jumps On Stranger's Dick To Pay For School	1	2014	\N	\N	Adult
tt7570410	tvEpisode	Hot Blonde Gets A Valentine's Day Fucking	Hot Blonde Gets A Valentine's Day Fucking	1	2014	\N	\N	Adult
tt7570414	tvEpisode	Shy Hottie Sheds Her Clothes When Stranger Proposes They Fuck	Shy Hottie Sheds Her Clothes When Stranger Proposes They Fuck	1	2014	\N	\N	Adult
tt7570416	tvEpisode	British Pornstar Makes Sure Stranger's Cock Is Up To The Challenge	British Pornstar Makes Sure Stranger's Cock Is Up To The Challenge	1	2014	\N	\N	Adult
tt7570418	tvEpisode	Woman Fucks A Stranger Because She Thinks She'll Be On TV	Woman Fucks A Stranger Because She Thinks She'll Be On TV	1	2014	\N	\N	Adult
tt7570424	tvEpisode	Anezka and Cayla	Anezka and Cayla	1	2014	\N	\N	Adult
tt7570426	tvEpisode	Episode dated 5 November 2017	Episode dated 5 November 2017	0	2017	\N	\N	News,Talk-Show
tt7570430	tvEpisode	Episode dated 19 November 2017	Episode dated 19 November 2017	0	2017	\N	\N	News,Talk-Show
tt7570432	tvEpisode	Episode dated 26 November 2017	Episode dated 26 November 2017	0	2017	\N	\N	News,Talk-Show
tt7570434	tvEpisode	Pretty Dark Haired Girl Surprises Stranger With Huge Tits	Pretty Dark Haired Girl Surprises Stranger With Huge Tits	1	2014	\N	\N	Adult
tt7570436	tvEpisode	Episode dated 11 November 1994	Episode dated 11 November 1994	0	1994	\N	\N	Family,Talk-Show
tt7570438	tvEpisode	Episode dated 23 April 1996	Episode dated 23 April 1996	0	1996	\N	\N	Family,Talk-Show
tt7570440	tvEpisode	Episode dated 12 November 2017	Episode dated 12 November 2017	0	2017	\N	\N	News,Talk-Show
tt7570442	tvEpisode	Episode dated 19 January 1994	Episode dated 19 January 1994	0	1994	\N	\N	Family,Talk-Show
tt7570444	tvEpisode	The Final Touches	The Final Touches	1	2014	\N	20	Adult
tt7570446	tvEpisode	János románca	János románca	0	2016	\N	\N	Comedy
tt7570448	tvSeries	Marshmallow People	Marshmallow People	0	2011	\N	2	Animation,Comedy,Short
tt7570450	tvEpisode	Episode dated 17 January 1995	Episode dated 17 January 1995	0	1995	\N	\N	Family,Talk-Show
tt7570454	tvEpisode	Let Us Teach You	Let Us Teach You	1	2014	\N	33	Adult
tt7570460	tvEpisode	Caught Skipping	Caught Skipping	1	2014	\N	25	Adult
tt7570462	tvEpisode	Episode dated 1 May 1957	Episode dated 1 May 1957	0	1957	\N	\N	Game-Show,Reality-TV
tt7570464	tvEpisode	Episode dated 3 December 1992	Episode dated 3 December 1992	0	1992	\N	\N	Family,Talk-Show
tt7570468	tvEpisode	Teach Me Mommy: Part One	Teach Me Mommy: Part One	1	2014	\N	32	Adult
tt7570472	tvEpisode	Eat My Muffin: Part One	Eat My Muffin: Part One	1	2014	\N	30	Adult
tt7570474	tvEpisode	Blake Shelton/Andrea Martin	Blake Shelton/Andrea Martin	0	2017	\N	41	Comedy,Music,Talk-Show
tt7570476	tvEpisode	Millie Bobby Brown/Kelly Clarkson	Millie Bobby Brown/Kelly Clarkson	0	2017	\N	41	Comedy,Music,Talk-Show
tt7570478	tvEpisode	Chris Hemsworth/Lindsey Vonn/Maroon 5 feat. SZA	Chris Hemsworth/Lindsey Vonn/Maroon 5 feat. SZA	0	2017	\N	40	Comedy,Music,Talk-Show
tt7570480	tvEpisode	Alec Baldwin/The Boys from Stranger Things/Josè Altuve/Elbow	Alec Baldwin/The Boys from Stranger Things/Josè Altuve/Elbow	0	2017	\N	41	Comedy,Music,Talk-Show
tt7570482	tvEpisode	Jeff Daniels/Mary J. Blige/Taylor Swift	Jeff Daniels/Mary J. Blige/Taylor Swift	0	2017	\N	41	Comedy,Music,Talk-Show
tt7570484	tvEpisode	Hands-on Sex Ed: Part One	Hands-on Sex Ed: Part One	1	2014	\N	30	Adult
tt7570486	tvEpisode	Episode dated 5 November 2017	Episode dated 5 November 2017	0	2017	\N	\N	News
tt7570488	tvEpisode	Heidi Klum/Sen. Bernie Sanders/Imagine Dragons	Heidi Klum/Sen. Bernie Sanders/Imagine Dragons	0	2017	\N	40	Comedy,Talk-Show
tt7570490	tvEpisode	Episode dated 12 November 2017	Episode dated 12 November 2017	0	2017	\N	\N	News
tt7570492	tvEpisode	Anthony Bourdain/Aya Cash/Anton Fig	Anthony Bourdain/Aya Cash/Anton Fig	0	2017	\N	\N	Comedy,Talk-Show
tt7570494	tvEpisode	Episode dated 19 November 2017	Episode dated 19 November 2017	0	2017	\N	\N	News
tt7570496	tvEpisode	The Break Up	The Break Up	1	2014	\N	34	Adult
tt7570498	tvEpisode	Blake Shelton/Robin Thede/Anton Fig	Blake Shelton/Robin Thede/Anton Fig	0	2017	\N	\N	Comedy,Talk-Show
tt7570500	tvEpisode	Rosie O'Donnell/David France/Anton Fig	Rosie O'Donnell/David France/Anton Fig	0	2017	\N	\N	Comedy,Talk-Show
tt7570502	tvEpisode	Episode dated 26 November 2017	Episode dated 26 November 2017	0	2017	\N	\N	News
tt7570504	tvEpisode	Episode #1.40	Episode #1.40	0	1974	\N	13	Drama
tt7570506	tvEpisode	Billy Eichner/Anna Camp/Weezer	Billy Eichner/Anna Camp/Weezer	0	2017	\N	\N	Comedy,Talk-Show
tt7570508	tvEpisode	Past Your Curfew	Past Your Curfew	1	2014	\N	28	Adult
tt7570510	tvEpisode	Mark Ruffalo/Chris Matthews/Gilbert Gottfried/Thundercat	Mark Ruffalo/Chris Matthews/Gilbert Gottfried/Thundercat	0	2017	\N	\N	Comedy,Talk-Show
tt7570512	tvEpisode	Nicole Kidman/Jonathan Groff/Walter Isaacson	Nicole Kidman/Jonathan Groff/Walter Isaacson	0	2017	\N	\N	Comedy,Talk-Show
tt7570514	tvEpisode	Ronan Farrow/Walter Isaacson/Kelsea Ballerini	Ronan Farrow/Walter Isaacson/Kelsea Ballerini	0	2017	\N	\N	Comedy,Talk-Show
tt7570518	tvEpisode	Whoopi Goldberg/Kathryn Hahn/Courtney Barnett & Kurt Vile	Whoopi Goldberg/Kathryn Hahn/Courtney Barnett & Kurt Vile	0	2017	\N	\N	Comedy,Talk-Show
tt7570522	tvEpisode	Mila Kunis/Jim Parsons/Sam Smith	Mila Kunis/Jim Parsons/Sam Smith	0	2017	\N	40	Comedy,Talk-Show
tt7570524	tvEpisode	Miles Teller/Whitney Cummings/Fergie	Miles Teller/Whitney Cummings/Fergie	0	2017	\N	40	Comedy,Talk-Show
tt7570526	tvEpisode	Allison Janney/Laurence Fishburne/Iliza Shlesinger	Allison Janney/Laurence Fishburne/Iliza Shlesinger	0	2017	\N	40	Comedy,Talk-Show
tt7570528	tvEpisode	Eat My Muffin: Part Two	Eat My Muffin: Part Two	1	2014	\N	28	Adult
tt7570530	tvEpisode	Kristen Bell/Dianna Agron/Gary Clark Jr.	Kristen Bell/Dianna Agron/Gary Clark Jr.	0	2017	\N	40	Comedy,Talk-Show
tt7570534	tvEpisode	The Sex Talk: Part Two	The Sex Talk: Part Two	1	2014	\N	27	Adult
tt7570538	tvEpisode	Hands-on Sex Ed: Part Two	Hands-on Sex Ed: Part Two	1	2014	\N	27	Adult
tt7570540	tvSeries	Furore	Furore	0	1997	2003	\N	Game-Show,Music
tt7570542	tvEpisode	The Store: Viral Promo Video	The Store: Viral Promo Video	1	2014	\N	\N	Adult
tt7570544	tvEpisode	Episode dated 18 December 2017	Episode dated 18 December 2017	0	2017	\N	\N	News,Talk-Show
tt7570546	tvEpisode	Episode dated 19 December 2017	Episode dated 19 December 2017	0	2017	\N	\N	News,Talk-Show
tt7570548	tvEpisode	After School Snack	After School Snack	1	2014	\N	22	Adult
tt7570550	tvEpisode	Episode dated 20 December 2017	Episode dated 20 December 2017	0	2017	\N	\N	News,Talk-Show
tt7570552	tvEpisode	Episode dated 21 December 2017	Episode dated 21 December 2017	0	2017	\N	\N	News,Talk-Show
