tconst	titleType	primaryTitle	originalTitle	isAdult	startYear	endYear	runtimeMinutes	genres
tt3990000	tvEpisode	La vida de Leonardo corre peligro	La vida de Leonardo corre peligro	0	2014	\N	44	Drama
tt3990002	tvEpisode	Intentan matar a Leonardo	Intentan matar a Leonardo	0	2014	\N	44	Drama
tt3990004	tvEpisode	Max intenta convencer a María Dolores para que denuncie a Daniel	Max intenta convencer a María Dolores para que denuncie a Daniel	0	2014	\N	44	Drama
tt3990006	tvEpisode	Maximiliano sufre por María Dolores	Maximiliano sufre por María Dolores	0	2014	\N	44	Drama
tt3990008	tvEpisode	Daniel deja plantada a María Dolores en el altar	Daniel deja plantada a María Dolores en el altar	0	2014	\N	44	Drama
tt3990010	tvEpisode	Ivana está embarazada	Ivana está embarazada	0	2014	\N	44	Drama
tt3990012	tvEpisode	María Dolores se casa con Daniel	María Dolores se casa con Daniel	0	2014	\N	44	Drama
tt3990014	tvEpisode	María Dolores acepta casarse con Daniel	María Dolores acepta casarse con Daniel	0	2014	\N	44	Drama
tt3990016	tvEpisode	Daniel y Max se enfrentan por María Dolores	Daniel y Max se enfrentan por María Dolores	0	2014	\N	44	Drama
tt3990018	tvEpisode	Daniel le propone matrimonio a María Dolores	Daniel le propone matrimonio a María Dolores	0	2014	\N	44	Drama
tt3990020	tvEpisode	Otra desgracia en la vida de María Dolores	Otra desgracia en la vida de María Dolores	0	2014	\N	44	Drama
tt3990022	tvEpisode	Maleny no quiere que Max se acerque a María Dolores	Maleny no quiere que Max se acerque a María Dolores	0	2014	\N	44	Drama
tt3990024	tvEpisode	María Dolores podría descubrir una gran verdad	María Dolores podría descubrir una gran verdad	0	2014	\N	44	Drama
tt3990026	tvEpisode	Daniel hará una dura confesión	Daniel hará una dura confesión	0	2014	\N	44	Drama
tt3990028	tvEpisode	María Dolores podría descubrir las mentiras de Daniel	María Dolores podría descubrir las mentiras de Daniel	0	2014	\N	44	Drama
tt3990030	tvEpisode	Daniel le propone matrimonio a Ivana	Daniel le propone matrimonio a Ivana	0	2014	\N	44	Drama
tt3990032	tvEpisode	María Dolores vivirá una de las peores humillaciones en su vida	María Dolores vivirá una de las peores humillaciones en su vida	0	2014	\N	44	Drama
tt3990034	tvEpisode	Maleny le propone matrimonio a Maximiliano	Maleny le propone matrimonio a Maximiliano	0	2014	\N	44	Drama
tt3990036	tvEpisode	Daniel demostrará por qué las mujeres dejan de creer en los hombres	Daniel demostrará por qué las mujeres dejan de creer en los hombres	0	2014	\N	44	Drama
tt3990038	tvEpisode	Las mentiras de Daniel, tienen las horas contadas	Las mentiras de Daniel, tienen las horas contadas	0	2014	\N	44	Drama
tt3990040	tvEpisode	Un encuentro podría dejar al descubierto los engaños	Un encuentro podría dejar al descubierto los engaños	0	2014	\N	44	Drama
tt3990042	tvEpisode	Maximiliano le pedirá una explicación a Maleny	Maximiliano le pedirá una explicación a Maleny	0	2014	\N	44	Drama
tt3990044	tvEpisode	Maximiliano acepta que, María Dolores es una mujer guapa	Maximiliano acepta que, María Dolores es una mujer guapa	0	2014	\N	44	Drama
tt3990046	tvEpisode	Isela podría descubrir una gran verdad	Isela podría descubrir una gran verdad	0	2014	\N	44	Drama
tt3990048	tvEpisode	La desgracia invade a María Dolores	La desgracia invade a María Dolores	0	2014	\N	44	Drama
tt3990050	tvEpisode	Episode dated 23 August 1973	Episode dated 23 August 1973	0	1973	\N	90	Talk-Show
tt3990052	tvEpisode	Norberto es descubierto por Manuel	Norberto es descubierto por Manuel	0	2014	\N	44	Drama
tt3990054	tvEpisode	Arturo dice a Luisa que se hará cargo del hijo que espera	Arturo dice a Luisa que se hará cargo del hijo que espera	0	2014	\N	44	Drama
tt3990056	tvEpisode	Acacia dice a Esteban que lo suyo es prohibido	Acacia dice a Esteban que lo suyo es prohibido	0	2014	\N	44	Drama
tt3990058	tvEpisode	Héctor le pide una oportunidad a Cristina	Héctor le pide una oportunidad a Cristina	0	2014	\N	44	Drama
tt3990060	tvEpisode	Acacia no logra alejarse de Esteban	Acacia no logra alejarse de Esteban	0	2014	\N	44	Drama
tt3990062	tvEpisode	Esteban le dice a Acacia que aunque su amor es prohibido, los dos lo desean	Esteban le dice a Acacia que aunque su amor es prohibido, los dos lo desean	0	2014	\N	44	Drama
tt3990064	tvEpisode	Cristina avienta las cosas del bebé que perdió	Cristina avienta las cosas del bebé que perdió	0	2014	\N	44	Drama
tt3990066	tvEpisode	Esteban descarga su enojo contra Acacia	Esteban descarga su enojo contra Acacia	0	2014	\N	44	Drama
tt3990068	tvEpisode	Esteban desenmascara a Juliana frente a sus hijos	Esteban desenmascara a Juliana frente a sus hijos	0	2014	\N	44	Drama
tt3990070	tvEpisode	Cristina escucha que Juliana se golpeó sola	Cristina escucha que Juliana se golpeó sola	0	2014	\N	44	Drama
tt3990072	tvEpisode	Acacia pone un alto a Esteban	Acacia pone un alto a Esteban	0	2014	\N	44	Drama
tt3990074	tvEpisode	Ulises rompe la carta que le escribió Acacia	Ulises rompe la carta que le escribió Acacia	0	2014	\N	44	Drama
tt3990076	tvEpisode	Ulises llega a buscar a Acacia	Ulises llega a buscar a Acacia	0	2014	\N	44	Drama
tt3990078	tvEpisode	Acacia pregunta a Esteban por qué regresó con su mamá	Acacia pregunta a Esteban por qué regresó con su mamá	0	2014	\N	44	Drama
tt3990080	tvEpisode	Acacia declarará en contra de Ulises	Acacia declarará en contra de Ulises	0	2014	\N	44	Drama
tt3990082	tvEpisode	Norberto amenaza de muerte a Andrés	Norberto amenaza de muerte a Andrés	0	2014	\N	44	Drama
tt3990084	tvEpisode	Héctor dice a Esteban que luchará por Cristina	Héctor dice a Esteban que luchará por Cristina	0	2014	\N	44	Drama
tt3990086	tvEpisode	Acacia amenaza con irse de la casa	Acacia amenaza con irse de la casa	0	2014	\N	44	Drama
tt3990088	tvEpisode	Cristina sospecha que hay otra mujer	Cristina sospecha que hay otra mujer	0	2014	\N	44	Drama
tt3990090	tvEpisode	Esteban desea estar con su hijastra	Esteban desea estar con su hijastra	0	2014	\N	44	Drama
tt3990092	tvEpisode	Ulises y Acacia se reencuentran	Ulises y Acacia se reencuentran	0	2014	\N	44	Drama
tt3990094	tvEpisode	Alejandra le dice a Germán, que acaba de casarse	Alejandra le dice a Germán, que acaba de casarse	0	2014	\N	44	Drama
tt3990096	tvEpisode	Acacia le pide a Esteban, que no abandone la casa	Acacia le pide a Esteban, que no abandone la casa	0	2014	\N	44	Drama
tt3990102	tvEpisode	Episode #1.15	Episode #1.15	0	2014	\N	\N	Talk-Show
tt3990104	tvEpisode	La derrota de Isabela	La derrota de Isabela	0	2014	\N	55	Comedy,Romance
tt3990106	tvEpisode	La fruta del dragón	La fruta del dragón	0	2014	\N	55	Comedy,Romance
tt3990108	tvEpisode	Jennifer, mi hermana	Jennifer, mi hermana	0	2014	\N	55	Comedy,Romance
tt3990110	tvEpisode	El límite de Fernando	El límite de Fernando	0	2014	\N	55	Comedy,Romance
tt3990112	tvEpisode	Antes de que se acabe el mundo	Antes de que se acabe el mundo	0	2014	\N	55	Comedy,Romance
tt3990114	tvEpisode	Pies de plomo	Pies de plomo	0	2014	\N	55	Comedy,Romance
tt3990116	tvEpisode	Lo que falta al corazón	Lo que falta al corazón	0	2014	\N	55	Comedy,Romance
tt3990118	tvEpisode	El mundo de Diego	El mundo de Diego	0	2014	\N	55	Comedy,Romance
tt3990120	tvEpisode	Los quince de Alicia	Los quince de Alicia	0	2014	\N	55	Comedy,Romance
tt3990122	tvEpisode	La madre sustituta	La madre sustituta	0	2014	\N	55	Comedy,Romance
tt3990124	tvEpisode	La canción de una madre	La canción de una madre	0	2014	\N	55	Comedy,Romance
tt3990126	tvEpisode	La furia de Isabela	La furia de Isabela	0	2014	\N	55	Comedy,Romance
tt3990128	tvEpisode	El amor cambia	El amor cambia	0	2014	\N	55	Comedy,Romance
tt3990130	tvEpisode	Ana le dice mamá a Yolanda	Ana le dice mamá a Yolanda	0	2014	\N	55	Comedy,Romance
tt3990132	tvEpisode	Un clavo puede sacar otro clavo	Un clavo puede sacar otro clavo	0	2014	\N	55	Comedy,Romance
tt3990134	tvEpisode	Al pie del cañón	Al pie del cañón	0	2014	\N	55	Comedy,Romance
tt3990136	tvEpisode	Cada quien en su casa	Cada quien en su casa	0	2014	\N	55	Comedy,Romance
tt3990138	tvEpisode	Noche de parejas	Noche de parejas	0	2014	\N	55	Comedy,Romance
tt3990140	tvEpisode	La bruja azul	La bruja azul	0	2014	\N	55	Comedy,Romance
tt3990142	tvEpisode	Un príncipe debe luchar por su princesa	Un príncipe debe luchar por su princesa	0	2014	\N	55	Comedy,Romance
tt3990144	tvEpisode	El nacimiento del amor	El nacimiento del amor	0	2014	\N	55	Comedy,Romance
tt3990146	tvEpisode	El secreto de Isabela	El secreto de Isabela	0	2014	\N	55	Comedy,Romance
tt3990148	tvEpisode	Los amores eternos son los más breves	Los amores eternos son los más breves	0	2014	\N	55	Comedy,Romance
tt3990152	tvEpisode	A Letter to Elia	A Letter to Elia	0	2010	\N	\N	Biography,Documentary,Music
tt3990154	tvEpisode	Zdro	Zdro	0	2015	\N	\N	Game-Show
tt3990156	tvEpisode	Su arrepentimiento le costará muy caro	Su arrepentimiento le costará muy caro	0	2014	\N	44	Drama,Romance
tt3990158	tvEpisode	Una noche de fantasía	Una noche de fantasía	0	2014	\N	44	Drama,Romance
tt3990160	tvEpisode	Los golpes que marcarán la historia	Los golpes que marcarán la historia	0	2014	\N	44	Drama,Romance
tt3990162	tvEpisode	Peleará por lo que es suyo	Peleará por lo que es suyo	0	2014	\N	44	Drama,Romance
tt3990164	tvEpisode	Un futuro sin amor	Un futuro sin amor	0	2014	\N	44	Drama,Romance
tt3990166	tvEpisode	Patricio y Chava llegan a los golpes	Patricio y Chava llegan a los golpes	0	2014	\N	44	Drama,Romance
tt3990168	tvEpisode	Chava no puede ocultar sus celos	Chava no puede ocultar sus celos	0	2014	\N	44	Drama,Romance
tt3990170	tvEpisode	Su primera vez fue mágica	Su primera vez fue mágica	0	2014	\N	44	Drama,Romance
tt3990172	tvEpisode	Está entre la espada y la pared	Está entre la espada y la pared	0	2014	\N	44	Drama,Romance
tt3990174	tvEpisode	La pasión hará que los descubran	La pasión hará que los descubran	0	2014	\N	44	Drama,Romance
tt3990176	tvEpisode	Chava, más sexy que nunca	Chava, más sexy que nunca	0	2014	\N	44	Drama,Romance
tt3990178	tvEpisode	Sofía sorprenderá a Patricio con Silvana	Sofía sorprenderá a Patricio con Silvana	0	2014	\N	44	Drama,Romance
tt3990180	tvEpisode	Chava dispuesto a pedirle matrimonio a Sofía	Chava dispuesto a pedirle matrimonio a Sofía	0	2014	\N	44	Drama,Romance
tt3990182	tvEpisode	La maldad corre a toda prisa	La maldad corre a toda prisa	0	2014	\N	44	Drama,Romance
tt3990184	tvEpisode	El amor le llegó de golpe y con un beso	El amor le llegó de golpe y con un beso	0	2014	\N	44	Drama,Romance
tt3990186	tvEpisode	Sofía está profundamente enamorada	Sofía está profundamente enamorada	0	2014	\N	44	Drama,Romance
tt3990188	tvEpisode	Le espera una noche de pasión	Le espera una noche de pasión	0	2014	\N	44	Drama,Romance
tt3990190	tvEpisode	Una verdad que ya no se puede ocultar	Una verdad que ya no se puede ocultar	0	2014	\N	44	Drama,Romance
tt3990192	tvEpisode	Araceli está de regreso en la vida de Chava	Araceli está de regreso en la vida de Chava	0	2014	\N	44	Drama,Romance
tt3990194	tvEpisode	Lo quiere cerca de ella	Lo quiere cerca de ella	0	2014	\N	44	Drama,Romance
tt3990196	tvEpisode	Conspiran contra Salvador	Conspiran contra Salvador	0	2014	\N	44	Drama,Romance
tt3990198	tvEpisode	Don Paco sufre un terrible infarto	Don Paco sufre un terrible infarto	0	2014	\N	44	Drama,Romance
tt3990200	tvEpisode	La vida de Armando está en riesgo	La vida de Armando está en riesgo	0	2014	\N	44	Drama,Romance
tt3990202	tvEpisode	Sofía tendrá a los enemigos, muy cerca	Sofía tendrá a los enemigos, muy cerca	0	2014	\N	44	Drama,Romance
tt3990204	tvEpisode	El mejor chofer	El mejor chofer	0	2014	\N	44	Drama,Romance
tt3990206	tvEpisode	The Doors: When You're Strange	The Doors: When You're Strange	0	2010	\N	\N	Biography,Documentary,Music
tt3990210	tvEpisode	Fishing for Souls	Fishing for Souls	0	2000	\N	\N	Adventure
tt3990214	tvMovie	Written By	Written By	0	2016	\N	\N	Comedy
tt3990218	tvEpisode	Episode dated 27 August 2014	Episode dated 27 August 2014	0	2014	\N	\N	News
tt3990224	tvEpisode	The Perils of Blodwen	The Perils of Blodwen	0	1970	\N	30	Comedy
tt3990226	tvSeries	Ground Control	Ground Control	0	2013	\N	\N	Comedy
tt3990230	tvEpisode	Gioie e dolori	Gioie e dolori	0	1997	\N	\N	Comedy
tt3990234	tvSeries	Jo Whiley	Jo Whiley	0	1998	2000	\N	Music,Talk-Show
tt3990238	tvEpisode	Episode dated 28 August 1973	Episode dated 28 August 1973	0	1973	\N	90	Talk-Show
tt3990242	tvMovie	Toccata	Toccata	0	1984	\N	67	Drama
tt3990244	tvEpisode	Princess Enjoys Her Presents: 2 Blondes at the Mercy of Her Whim.Pt.1	Princess Enjoys Her Presents: 2 Blondes at the Mercy of Her Whim.Pt.1	1	2014	\N	\N	Adult
tt3990246	tvEpisode	Ordination of Donnie Romero	Ordination of Donnie Romero	0	2014	\N	50	Reality-TV
tt3990248	tvEpisode	Demolished and Disgraced in Public	Demolished and Disgraced in Public	1	2014	\N	\N	Adult
tt3990252	tvEpisode	Shunt McGuppin	Shunt McGuppin	0	2014	\N	\N	Animation,Comedy,Short
tt3990254	tvEpisode	Fuck Puppy Makes a Mess of Herself as She Is Disgraced by Strangers	Fuck Puppy Makes a Mess of Herself as She Is Disgraced by Strangers	1	2014	\N	\N	Adult
tt3990256	tvEpisode	Commandments in Genesis	Commandments in Genesis	0	2014	\N	65	Reality-TV
tt3990260	tvEpisode	Blond Bitch Fucked Silly at a Crazy House Party.Squirting, DP, Fisting	Blond Bitch Fucked Silly at a Crazy House Party.Squirting, DP, Fisting	1	2014	\N	\N	Adult
tt3990262	tvEpisode	Episode #1.1	Episode #1.1	0	1989	\N	\N	Family
tt3990266	tvEpisode	L'anello di San Martino	L'anello di San Martino	0	1998	\N	\N	Comedy
tt3990270	tvEpisode	Princess Donna's Epic Birthday Bask: Part 2	Princess Donna's Epic Birthday Bask: Part 2	1	2014	\N	\N	Adult
tt3990272	tvEpisode	Served Up and Fucked and a Diner Party. Splosh!	Served Up and Fucked and a Diner Party. Splosh!	1	2014	\N	\N	Adult
tt3990276	tvEpisode	Un lavoro di squadra	Un lavoro di squadra	0	1998	\N	\N	Comedy
tt3990280	tvSeries	Skyrunners Inside the Alien Lair	Skyrunners Inside the Alien Lair	0	2009	\N	\N	Sci-Fi
tt3990284	tvEpisode	Midwestern Fuckslut Maley Blaze Gets Ass Pounded in Extreme Bondage.	Midwestern Fuckslut Maley Blaze Gets Ass Pounded in Extreme Bondage.	1	2014	\N	\N	Adult
tt3990288	tvEpisode	Lexington Steele Breaks in His New Pet in This Interracial Fuck Fest!	Lexington Steele Breaks in His New Pet in This Interracial Fuck Fest!	1	2014	\N	\N	Adult
tt3990290	tvEpisode	Princess Cleans This Filthy Whore Into Humiliating Submission.	Princess Cleans This Filthy Whore Into Humiliating Submission.	1	2014	\N	\N	Adult
tt3990306	tvEpisode	Hard Fucking at a Noisy Punk Show-Anal, Squirting and Bondage	Hard Fucking at a Noisy Punk Show-Anal, Squirting and Bondage	1	2014	\N	\N	Adult
tt3990308	tvEpisode	Changing Times	Changing Times	0	2014	\N	\N	Documentary
tt3990310	tvEpisode	Reality Bites	Reality Bites	0	2014	\N	\N	Documentary
tt3990314	tvEpisode	Enemy Within	Enemy Within	0	2014	\N	\N	Documentary
tt3990316	tvEpisode	Shock and Awe	Shock and Awe	0	2014	\N	\N	Documentary
tt3990330	tvEpisode	Soul-winning Methods	Soul-winning Methods	0	2008	\N	77	Reality-TV
tt3990332	tvEpisode	Itty Bitty Emma Haze Bound, Suspended and Fucked from Both Ends.	Itty Bitty Emma Haze Bound, Suspended and Fucked from Both Ends.	1	2014	\N	\N	Adult
tt3990334	tvEpisode	Exposed	Exposed	0	2014	\N	\N	Documentary
tt3990340	tvEpisode	The Countdown	The Countdown	0	2014	\N	\N	Documentary
tt3990346	tvEpisode	The Bill of Rights in Light of the Bible	The Bill of Rights in Light of the Bible	0	2008	\N	70	Reality-TV
tt3990348	tvEpisode	Dirty Fuck Doll Gaia Begs to Be Fucked and Used.	Dirty Fuck Doll Gaia Begs to Be Fucked and Used.	1	2014	\N	\N	Adult
tt3990354	tvEpisode	Speak Often One to Another	Speak Often One to Another	0	2008	\N	54	Reality-TV
tt3990356	tvEpisode	Episode #3.27	Episode #3.27	0	1996	\N	\N	Comedy,Family,Game-Show
tt3990358	tvEpisode	Stoner Girls #Caturdays	Stoner Girls #Caturdays	0	2014	\N	\N	Comedy
tt3990360	tvEpisode	Episode dated 30 August 1973	Episode dated 30 August 1973	0	1973	\N	90	Talk-Show
tt3990366	tvEpisode	Sloppy Whore Lily Labeau Gets Fucked in a Corner Pocket!	Sloppy Whore Lily Labeau Gets Fucked in a Corner Pocket!	1	2014	\N	\N	Adult
tt3990368	tvEpisode	False Bretheren	False Bretheren	0	2008	\N	53	Reality-TV
tt3990370	tvEpisode	Attention Whore Gets Ass-pounded in 3 Different Bondage Positions.	Attention Whore Gets Ass-pounded in 3 Different Bondage Positions.	1	2014	\N	\N	Adult
tt3990376	tvEpisode	First Boy/Girl Scene in a Rowdy Biker Bar. Pounded, Drilled, Fisted.	First Boy/Girl Scene in a Rowdy Biker Bar. Pounded, Drilled, Fisted.	1	2014	\N	\N	Adult
tt3990382	tvEpisode	Isaiah 24	Isaiah 24	0	2008	\N	62	Reality-TV
tt3990386	tvEpisode	Interracial Fuck Fest. Isis Love Guest Stars.	Interracial Fuck Fest. Isis Love Guest Stars.	1	2014	\N	\N	Adult
tt3990392	tvEpisode	Isaiah 18	Isaiah 18	0	2008	\N	53	Reality-TV
tt3990394	tvEpisode	19 Year Old, Mandy Muse Tied Up and Fucked Hard. Electric Foreplay	19 Year Old, Mandy Muse Tied Up and Fucked Hard. Electric Foreplay	1	2014	\N	\N	Adult
tt3990398	tvEpisode	Filthy Fuck-hole Humiliated in Front of a Bunch of Oakland Hipsters.	Filthy Fuck-hole Humiliated in Front of a Bunch of Oakland Hipsters.	1	2014	\N	\N	Adult
tt3990400	tvEpisode	Her Cunt Just Can't Get Enough. Sexy Blonde on Display in Public.	Her Cunt Just Can't Get Enough. Sexy Blonde on Display in Public.	1	2014	\N	\N	Adult
tt3990404	tvEpisode	Blood for the Blood God	Blood for the Blood God	0	2010	\N	\N	Comedy
tt3990406	tvEpisode	Forgiveness	Forgiveness	0	2008	\N	61	Reality-TV
tt3990408	tvEpisode	Vivi Marie Loves Attention. Sweet Little Whore Fucked and Disgraced.	Vivi Marie Loves Attention. Sweet Little Whore Fucked and Disgraced.	1	2014	\N	\N	Adult
tt3990410	tvEpisode	Episode dated 26 August 2014	Episode dated 26 August 2014	0	2014	\N	\N	Talk-Show
tt3990416	tvEpisode	Innocent Asian Slut Humiliated and Fucked in Convenient Store	Innocent Asian Slut Humiliated and Fucked in Convenient Store	1	2014	\N	\N	Adult
tt3990418	tvEpisode	Episode dated 24 August 1996	Episode dated 24 August 1996	0	1996	\N	\N	Music,Talk-Show
tt3990420	tvEpisode	Girl Next Door Takes It Deep in the Ass. Pounded in Public!	Girl Next Door Takes It Deep in the Ass. Pounded in Public!	1	2014	\N	\N	Adult
tt3990422	tvEpisode	Ultimate Surrender Loser Gets Taught a Lesson, Public Disgrace Style	Ultimate Surrender Loser Gets Taught a Lesson, Public Disgrace Style	1	2014	\N	\N	Adult
tt3990428	tvEpisode	Here in Spirit	Here in Spirit	0	2014	\N	\N	Reality-TV
tt3990430	tvEpisode	Amy Takes It All in First Ever Porn Shoot	Amy Takes It All in First Ever Porn Shoot	1	2014	\N	\N	Adult
tt3990432	tvEpisode	Purity	Purity	0	2011	\N	47	Reality-TV
tt3990434	tvSeries	Magische Orte	Magische Orte	0	2005	\N	43	Documentary
tt3990436	tvEpisode	El reloj	El reloj	0	2014	\N	\N	Comedy,Drama,Romance
tt3990438	tvEpisode	Right and Wrong Clothing	Right and Wrong Clothing	0	2012	\N	61	Reality-TV
tt3990440	tvEpisode	Little Miss Heart Learns How to Take It and Take It Hard - In Public!	Little Miss Heart Learns How to Take It and Take It Hard - In Public!	1	2014	\N	\N	Adult
tt3990442	tvEpisode	Filthy Cock-sucking Gym Rat Defiled on Public Disgrace!	Filthy Cock-sucking Gym Rat Defiled on Public Disgrace!	1	2014	\N	\N	Adult
tt3990444	tvEpisode	Timid Lady Finds Her Inner Whore. Fucked and Disgraced in Public!	Timid Lady Finds Her Inner Whore. Fucked and Disgraced in Public!	1	2014	\N	\N	Adult
tt3990446	tvEpisode	The Millennium	The Millennium	0	2010	\N	72	Reality-TV
tt3990450	tvEpisode	Beyonce's Advice	Beyonce's Advice	0	2014	\N	\N	Comedy,Short
tt3990452	tvEpisode	Blindfolded and Pounded in an Ally. Huge Natural Tits, Luscious Booty.	Blindfolded and Pounded in an Ally. Huge Natural Tits, Luscious Booty.	1	2014	\N	\N	Adult
tt3990454	tvEpisode	Get Your Yoga On	Get Your Yoga On	0	2014	\N	\N	Comedy,Drama
tt3990458	tvEpisode	Tempting Girl Next Door Ass Pounded in a Pizza Joint. Extreme Fisting!	Tempting Girl Next Door Ass Pounded in a Pizza Joint. Extreme Fisting!	1	2014	\N	\N	Adult
tt3990460	tvEpisode	Following a Multitude to Do Evil	Following a Multitude to Do Evil	0	2011	\N	60	Reality-TV
tt3990462	tvEpisode	Christophe Colomb	Christophe Colomb	0	1973	\N	\N	Crime,Thriller
tt3990464	tvEpisode	An Evil Disease	An Evil Disease	0	2010	\N	46	Reality-TV
tt3990470	tvEpisode	Etes-vous seul?	Etes-vous seul?	0	1974	\N	\N	Crime,Thriller
tt3990474	tvEpisode	Lessons from Leveticus	Lessons from Leveticus	0	2011	\N	92	Reality-TV
tt3990478	tvEpisode	Where's My Warrior?	Where's My Warrior?	0	2014	\N	\N	Comedy
tt3990482	tvEpisode	Episode dated 5 September 2014	Episode dated 5 September 2014	0	2014	\N	42	Talk-Show
tt3990484	tvEpisode	Lobster Club	Lobster Club	0	2014	\N	\N	Comedy
tt3990486	tvEpisode	Episode dated 12 September 2014	Episode dated 12 September 2014	0	2014	\N	42	Talk-Show
tt3990488	tvEpisode	Tube Steak	Tube Steak	0	2014	\N	\N	Comedy
tt3990490	tvEpisode	Beast	Beast	0	2014	\N	\N	Comedy
tt3990492	tvEpisode	Episode #22.10	Episode #22.10	0	1998	\N	\N	Talk-Show
tt3990494	tvEpisode	Luis Palau Exposed	Luis Palau Exposed	0	2011	\N	7	Reality-TV
tt3990496	tvEpisode	The Stanley Superhero	The Stanley Superhero	0	2014	\N	\N	Comedy
tt3990498	tvEpisode	Pastor Steven L Anderson Preaching at Verity Baptist Church	Pastor Steven L Anderson Preaching at Verity Baptist Church	0	2011	\N	59	Reality-TV
tt3990500	tvEpisode	The Stanley Grandpa	The Stanley Grandpa	0	2015	\N	\N	Comedy
tt3990502	tvEpisode	Episode dated 27 August 2014	Episode dated 27 August 2014	0	2014	\N	\N	News,Talk-Show
tt3990504	tvMovie	Atonement	Atonement	0	1995	\N	22	Documentary
tt3990506	tvEpisode	Cursing and Swearing	Cursing and Swearing	0	2011	\N	71	Reality-TV
tt3990508	tvEpisode	The Stanley Dodger	The Stanley Dodger	0	2014	\N	\N	Comedy
tt3990512	tvEpisode	The Stanley Spirit	The Stanley Spirit	0	\N	\N	\N	Comedy
tt3990518	tvEpisode	The Virgin Mary	The Virgin Mary	0	2011	\N	45	Reality-TV
tt3990520	tvEpisode	Episode #1.10480	Episode #1.10480	0	2014	\N	\N	Drama,Romance
tt3990522	tvEpisode	Best of Series 1 & 2	Best of Series 1 & 2	0	2014	\N	\N	Family,Reality-TV
tt3990526	tvEpisode	Le restaurant	Le restaurant	0	1958	\N	15	Comedy,Family,Short
tt3990530	tvEpisode	Paris	Paris	0	2014	\N	\N	Family,Reality-TV
tt3990532	tvEpisode	Underwater	Underwater	0	2014	\N	\N	Family,Reality-TV
tt3990534	tvEpisode	Halfway to a Donut	Halfway to a Donut	0	2014	\N	50	Crime,Drama,Mystery
tt3990536	tvSeries	Dateline Scotland	Dateline Scotland	0	2014	\N	\N	Comedy
tt3990540	tvEpisode	Attention Whore Plays Doctor. Speculum in the Pussy, Cock in the Ass.	Attention Whore Plays Doctor. Speculum in the Pussy, Cock in the Ass.	1	2014	\N	\N	Adult
tt3990548	tvEpisode	Covetousness	Covetousness	0	2008	\N	53	Reality-TV
tt3990550	tvEpisode	The Musk Who Fell to Earth	The Musk Who Fell to Earth	0	2015	\N	22	Animation,Comedy
tt3990552	tvEpisode	Baptist Bride Heresy Debunked	Baptist Bride Heresy Debunked	0	2008	\N	51	Reality-TV
tt3990556	tvEpisode	Episode #1.3939	Episode #1.3939	0	2014	\N	\N	Drama,Romance
tt3990558	tvEpisode	John Hagee the Heretic from Hell	John Hagee the Heretic from Hell	0	2008	\N	3	Reality-TV
tt3990562	tvSeries	Qeios	Qeios	0	2014	\N	\N	Animation,Comedy,Fantasy
tt3990564	tvEpisode	Na to musí chlap prijít sám	Na to musí chlap prijít sám	0	2009	\N	\N	Comedy,Drama,Romance
tt3990566	tvEpisode	I <3 Shake It Up Night	I <3 Shake It Up Night	0	2013	\N	\N	Biography
tt3990568	tvEpisode	Better in Stereo with Dove Cameron	Better in Stereo with Dove Cameron	0	2013	\N	\N	Biography
tt3990578	tvEpisode	The Jews Are the Racists	The Jews Are the Racists	0	2014	\N	4	Reality-TV,Short
tt3990580	tvEpisode	Star Wars Lightsaber Katana	Star Wars Lightsaber Katana	0	2014	\N	\N	Reality-TV
tt3990584	tvEpisode	Episode dated 18 January 2000	Episode dated 18 January 2000	0	2000	\N	\N	Talk-Show
tt3990586	tvEpisode	Eat, Pray, Run	Eat, Pray, Run	0	2014	\N	44	Reality-TV
tt3990588	tvEpisode	All Apologies	All Apologies	0	2014	\N	44	Reality-TV
tt3990590	tvMovie	Jazz Scene	Jazz Scene	0	1960	\N	30	Music
tt3990594	tvEpisode	Reunion Part 1	Reunion Part 1	0	2014	\N	44	Reality-TV
tt3990596	tvEpisode	A Little Less Conversation	A Little Less Conversation	0	2014	\N	\N	Comedy
tt3990602	tvEpisode	Svatba jako remen	Svatba jako remen	0	2014	\N	\N	Comedy,Drama,Romance
tt3990604	tvEpisode	Episode #2.210	Episode #2.210	0	2014	\N	\N	News
tt3990606	tvEpisode	Hard to Swallow	Hard to Swallow	0	2014	\N	43	Reality-TV
tt3990608	tvEpisode	Captain America's Throwing Shields	Captain America's Throwing Shields	0	2014	\N	\N	Reality-TV
tt3990610	tvEpisode	After All	After All	0	2014	\N	\N	Comedy
tt3990626	tvEpisode	Episode #10.7	Episode #10.7	0	2014	\N	\N	Family
tt3990638	tvSeries	The Operatives	The Operatives	0	2014	\N	46	Reality-TV
tt3990642	tvEpisode	Episode #1.13127	Episode #1.13127	0	2014	\N	37	Crime,Drama,Romance
tt3990646	tvMovie	Leocadia	Leocadia	0	1954	\N	85	Comedy
tt3990648	tvSeries	Flordeluna	Flordeluna	0	1978	\N	\N	Drama
tt3990650	tvEpisode	Episode #1.1	Episode #1.1	0	1976	\N	135	Biography,Drama
tt3990652	tvEpisode	Episode #1.2	Episode #1.2	0	1976	\N	135	Biography,Drama
tt3990654	tvEpisode	Episode dated 4 April 2014	Episode dated 4 April 2014	0	2014	\N	\N	Sport,Talk-Show
tt3990656	tvEpisode	Episode dated 18 April 2014	Episode dated 18 April 2014	0	2014	\N	\N	Sport,Talk-Show
tt3990658	tvEpisode	A Visão	A Visão	0	2014	\N	\N	Comedy,Drama,Romance
tt3990660	tvEpisode	Schwesterschmerzen	Schwesterschmerzen	0	2014	\N	44	Drama,Romance
tt3990662	tvEpisode	Ajuste de Contas	Ajuste de Contas	0	2014	\N	\N	Comedy,Drama,Romance
tt3990664	tvEpisode	Episode dated 1 March 2002	Episode dated 1 March 2002	0	2002	\N	\N	Comedy
tt3990668	tvEpisode	Amor com C	Amor com C	0	2014	\N	\N	Comedy,Drama,Romance
tt3990670	tvEpisode	Recordar, Renascer	Recordar, Renascer	0	2014	\N	\N	Comedy,Drama,Romance
tt3990678	tvEpisode	Papa a Papa	Papa a Papa	0	2014	\N	\N	Comedy,Drama,Romance
tt3990680	tvEpisode	Mask	Mask	0	2015	\N	\N	Drama,Horror,Mystery
tt3990682	tvEpisode	Am Kreuzweg	Am Kreuzweg	0	2014	\N	44	Drama,Romance
tt3990692	tvEpisode	Do Gooders	Do Gooders	0	2014	\N	\N	Talk-Show
