tconst	titleType	primaryTitle	originalTitle	isAdult	startYear	endYear	runtimeMinutes	genres
tt16781352	movie	Our Sisters in Spirit	Our Sisters in Spirit	0	2018	\N	35	Documentary
tt16781874	movie	Daiki Tsuneta Tokyo Chaotic	Daiki Tsuneta Tokyo Chaotic	0	2021	\N	99	Documentary
tt16786110	movie	Covering Hollywood	Covering Hollywood	0	\N	\N	\N	Biography
tt16787020	movie	Last Man Standing: The Chronicles of Myron Sugerman	Last Man Standing: The Chronicles of Myron Sugerman	0	2022	\N	\N	Crime,Documentary
tt16788530	movie	A Walk on Water	A Walk on Water	0	2021	\N	\N	Drama
tt16788570	movie	All Madden	All Madden	0	2021	\N	92	Documentary,Sport
tt16788716	movie	Jackie Goes to School	Jackie Goes to School	0	2014	\N	\N	Drama
